{
  "name": "forgeflow",
  "version": "1.3.3",
  "description": "Artifact-first delivery workflow for AI coding agents: clarify, plan, execute, review, ship through markdown artifacts and prompt-driven gates",
  "author": {
    "name": "gimso2x",
    "url": "https://github.com/gimso2x"
  },
  "repository": "https://github.com/gimso2x/forgeflow",
  "license": "MIT",
  "keywords": [
    "ai-agents",
    "workflow",
    "artifacts",
    "claude-code",
    "codex",
    "gemini"
  ]
}
